,questions,answers
50,Winamax est-il compatible avec Macintosh® ?,Le logiciel fonctionne parfaitement sur toutes les versions de MAC OS à partir de la version 10.4.
51,Winamax est-il compatible avec Linux ?,"Pour jouer sur Winamax depuis une distribution Linux, rien de plus simple : notre logiciel est accessible sans téléchargement depuis les principaux navigateurs Internet, avec les mêmes fonctions et un look identique au logiciel."
52,Winamax est-il accessible sur mon smartphone ?,Le logiciel est disponible sur Android (mobiles et tablettes) et sur iOS (iPhone et iPad).
53,J’ai rencontré un problème de connexion lors d'une partie,"Ce type d’incident peut avoir des causes multiples, inhérentes au fonctionnement d'Internet (votre PC, votre fournisseur d'accès, les liens entre votre fournisseur d'accès, nos serveurs, etc.).

En cas de déconnexion, vous passez automatiquement en mode ""Check/Fold"", pour ne pas perdre d'argent. Pour retrouver vos tables de jeu en cas de déconnexion, nous vous conseillons de redémarrer l'application. Si vous n’êtes pas réintégré à vos tables automatiquement, cliquez sur le bouton « Mon compte », puis rendez-vous sur l’onglet « Mes parties ».

Si vous pensez que ce problème n'est pas lié à votre connexion internet ou à votre ordinateur, merci de nous préciser la date, l'heure et l'identifiant du tournoi ou de la table de cash game concerné. En cas de doute, vous pouvez consulter votre historique de compte.

S’il est avéré que ce problème est lié à un incident technique provenant de nos services, nous conviendrons d'un remboursement selon les modalités prévues par l'article 3 ""DYSFONCTIONNEMENTS, DECONNEXIONS ET BUGS"" de nos Conditions Générales d'Utilisation."
54,Je n’arrive pas à installer le logiciel sous Windows®,"Si vous rencontrez des difficultés lors de l’installation de notre logiciel, nous vous invitons à suivre la procédure suivante :

•	Désinstallez les éventuelles versions existantes de l’application Winamax en utilisant le gestionnaire d’application Windows ou en exécutant le fichier C:\Users\[NOM DE VOTRE SESSION]\Winamax\uninstall.exe.

•	Une fois la désinstallation effectuée, assurez-vous que le répertoire suivant a bien été effacé :
C:\Users\[NOM DE VOTRE SESSION)\Winamax\ (si ce n'est pas le cas, supprimez-le manuellement)
•	Installez ensuite la dernière version de notre application en vous rendant sur la page ci-dessous : 

https://www.winamax.fr/jouer-au-poker?dl=1

Si malgré cette procédure, vous ne parvenez toujours pas à installer le logiciel, veuillez contacter le support en répondant à ces questions :

•	Quel est votre système d'exploitation ? Son numéro de version (précisez s’il y a des services pack) ?
•	Utilisez-vous un antivirus ? Si oui, lequel ? L’installation fonctionne-t-elle en le désactivant ?
•	Avez-vous reçu un message d’erreur particulier ?

Nous vous demanderons aussi de nous faire parvenir une capture d'écran illustrant la situation. Pour cela, pressez la touche « Impr Ecran » située en haut à droite de votre clavier. Récupérez la capture d’écran en ouvrant un logiciel tel que Paint ou Word, et faites un collé (clic droit/coller ou Ctrl + V).
Enfin, il sera également nécessaire de nous nous faire parvenir les fichiers ""logs"" d'installation (C:\Users\[NOM DE VOTRE SESSION] \Appdata\Local\Temp\winamax.install.log)"
55,Je n’arrive pas à installer le logiciel sous Macintosh®,"Si vous rencontrez des difficultés lors de l’installation de notre logiciel, nous vous invitons à suivre la procédure suivante :

•	Supprimez les éventuelles versions existantes de l’application Winamax de votre ordinateur.
•	Installez la dernière version de notre application en vous rendant sur la page ci-dessous : https://www.winamax.fr/jouer-au-poker?dl=1

Si toutefois vous rencontrez des difficultés lors de l’installation de notre logiciel, veuillez contacter le support en répondant à ces questions :

•	Quel est votre système d'exploitation ? Son numéro de version ?
•	Utilisez-vous un antivirus ? Si oui, lequel ? L’installation fonctionne-t-elle en le désactivant ?
•	Avez-vous reçu un message d’erreur particulier ?

Nous vous demanderons aussi de nous faire parvenir une capture d'écran illustrant la situation. Pour cela, appuyez simultanément sur les touches cmd + MAJ + 3. La capture d’écran est automatiquement sauvegardée sur le bureau. 

Enfin, il sera également nécessaire de nous nous faire parvenir les fichiers ""logs"" d'installation (/tmp/winamax.install.log)."
56,Je voudrais annuler un pari que je viens de placer,"Une fois qu’un pari a été validé, il n’est pas possible de le modifier ou de l’annuler. Pour plus d'informations à ce sujet, vous pouvez consulter le règlement des paris sportifs."
57,Je n’ai pas reçu les gains de mon pari gagnant,"De manière générale, les paris sportifs effectués sur notre site sont payés une fois le résultat officiel de la rencontre publié.

Cependant, il peut arriver à de rares occasions qu'il y ait un léger délai dans le versement des gains."
58,L’un des paris de mon combiné a été annulé,"Dans un pari combiné, si une ou plusieurs sélections sont annulées (par exemple suite à l'abandon d'un joueur), elles sont considérées comme gagnantes avec une cote de 1,00. La cote globale de votre pari est alors recalculée.
Pour plus d’informations à ce sujet, nous vous invitons à consulter l’article 5 du règlement des paris sportifs."
59,L’un des paris de mon MyMatch a été annulé,"Si une sélection est annulée à l’intérieur d’un MyMatch, le MyMatch entier est annulé quelle que soit l’issue des autres sélections. Pour plus d’informations à ce sujet, nous vous invitons à consulter le règlement de cette offre."
60,Les paris sportifs permettent-ils de remporter des Miles ?,"Lorsque vous placez des paris sportifs, vous cumulez des points de fidélité, appelés Miles. 
Lors d’un pari (simple ou combiné) ces Miles sont gagnés en fonction du montant de la mise et de la cote du pari. Pour chaque euro parié, les joueurs cumulent ainsi : 
1€ x 0,4 x (1 - 1/Cote).
Exemple - Vous pariez 100€ à une cote de 2,5 contre 1. Le calcul se décompose ainsi :
100€ x 0,4 x (1 – (1/2,5)) = 24 miles engrangés

Vous pouvez engranger des Miles de manière beaucoup plus rapide grâce au statut VIP et le coefficient multiplicateur correspondant. Plus  votre statut VIP sera élevé, plus vous collecterez rapidement des Miles. 

Si l’on reprend l’exemple ci-dessus dans le cas d’un statut VIP Diamond *, dont le coefficient multiplicateur est de 3, vous collecterez un total de 24 x 3 = 72 miles."
61,Que sont les Freebets ?,"Les Freebets sont des paris gratuits offerts par Winamax dans le cadre d'offres promotionnelles. Ils peuvent être utilisés en plaçant des paris sur tous les sports. 

Votre solde de Freebets est visible à côté de votre solde en argent réel (en-dessous sur la version mobile).

Pour utiliser vos Freebets, il vous suffit d'activer le bouton ""Pariez en Freebets"" au moment de votre prise de pari. Si votre pari est gagnant, seuls les gains nets (gains - mise) sont crédités sur votre compte. 

Pour plus d'informations sur les Freebets, nous vous invitons à consulter la page dédiée.

Pour gagner tous les jours des Freebets, nous vous recommandons chaudement de suivre nos comptes sport sur les réseaux sociaux : 

- https://twitter.com/WinamaxSport

- https://www.facebook.com/winamaxsport"
62,Comment fonctionnent les paris système ?,"Les paris système vous permettent de parier en une seule fois sur plusieurs paris combinés. Ils vous permettent de remporter des gains même si un ou plusieurs pronostics de votre combiné initial ne se sont pas réalisés.

Retrouvez les détails du fonctionnement des paris système sur la page suivante : https://www.winamax.fr/paris-systeme"
63,Comment fonctionnent les favoris ?,"Sélectionnez les matchs que vous souhaitez ajouter à vos favoris en cliquant sur l'étoile à coté de ces matchs. La couleur jaune de l'étoile vous confirme que le match a bien été ajouté. Vous pouvez cliquer à nouveau sur l'étoile pour enlever le match de vos favoris.
Retrouvez vos matchs favoris en cliquant sur le bouton ""Mes favoris"", dans le menu de gauche. Seuls ces matchs apparaîtront, et vous pourrez ainsi suivre plus facilement les matchs que vous souhaitez.

Vos favoris restent en place d'une session à l'autre.

Lorsque vous pariez sur un match, ce match est automatiquement ajouté à vos favoris. Cette option peut être désactivée à l'adresse suivante : https://www.winamax.fr/mon-compte_options-paris-sportif"
