,questions,answers
0,Comment compléter mon inscription ?,"Pour compléter votre inscription et accéder aux tables de poker et paris sportifs en argent réel, il est nécessaire de valider votre compte en nous faisant parvenir les documents listés ci-dessous :

• La copie recto/verso de votre carte nationale d’identité (CNI) OU de votre passeport OU de votre permis de conduire OU de votre titre de séjour (recto/verso) au choix. Le document choisi doit être en cours de validité et la copie de très bonne qualité (scan PDF ou photographie JPG, par exemple)
•  Un justificatif de domicile à votre nom (facture de téléphone, d’internet, d’eau de gaz ou d’électricité , quittance de loyer ou avis d’imposition) 

Vous pouvez nous faire parvenir ces documents par l'un des moyens suivants :

•  Directement depuis votre Espace personnel
•  Par mail à l’adresse support@winamax.fr
•  Par courrier postal (sans affranchir) à l'adresse suivante :

WINAMAX
LIBRE REPONSE 80986
75342 PARIS CEDEX 07

Nous vous rappelons par ailleurs que votre compte sera automatiquement suspendu si vos documents n'ont pas été validés sous 30 jours après son activation en argent réel. 

Pour valider votre adresse postale, au lieu de fournir un justificatif de domicile, vous pouvez choisir l’envoi par courrier postal d’un code d’activation à votre domicile. À réception, vous devrez renseigner ce code personnel sur votre compte.

Si votre compte n’est toujours pas validé à l'issue d'un délai de 60 jours, à compter du passage en argent réel, celui-ci sera définitivement clôturé."
1,Mes documents ont été validés mais mon compte est bloqué,"Une fois votre compte validé (pièce d’identité et justificatif de domicile validés ou code de validation saisi), un seuil de retrait automatique doit être défini sur cette page.

Une fois cette procédure effectuée, votre compte sera immédiatement débloqué."
2,J’ai renseigné une date de naissance incorrecte et je ne peux pas me connecter,"Afin que vous puissiez vous connecter, nous vous invitons à nous transmettre les documents listés dans la rubrique « Compléter mon inscription ».

Une fois ces deux documents reçus par email ou par courrier, nous pourrons alors modifier vos informations, si nécessaire, afin que vous puissiez vous connecter."
3,Je n'ai pas reçu mon email d'activation,"Il se peut qu'un logiciel de type anti-spam ait considéré notre email d'activation de votre compte comme un courrier indésirable. Si tel est le cas, vous devriez retrouver ce mail dans un sous-dossier de votre boîte mail, du type ""Courrier indésirable"" ou ""Spam"".

Nous vous recommandons alors de configurer votre logiciel de messagerie ou votre filtre anti-spam de manière à accepter ""Winamax.fr"" comme un expéditeur de confiance.
Si vous n'avez toujours pas reçu le mail permettant d'activer votre compte Winamax, écrivez au support depuis l'adresse mail liée à votre compte Winamax."
4,J'ai oublié mon mot de passe,"Pour vous connecter à Winamax, vous devez indiquer votre adresse email complète et votre mot de passe. 

Si vous ne vous souvenez plus de votre mot de passe, vous devriez avoir un message d'erreur ""Mauvais Email ou mot de passe"" (Wrong e-mail address or password) lorsque vous tentez de vous connecter.

Cliquez alors sur le lien ""Mot de passe oublié ?"" puis saisissez votre adresse email et vous recevrez dans les minutes qui suivent un email vous permettant de choisir un nouveau mot de passe. Vous pouvez également vous rendre directement sur cette page."
5,J'ai oublié le mot de passe de mon compte Winamax et je n'ai plus accès à l'adresse mail associée,"Dans ce cas, veuillez contacter le support en joignant une photo de vous tenant dans votre main votre pièce d'identité (carte nationale d'identité, permis de conduire ou passeport) en cours de validité ainsi qu'un document justifiant la date du jour.

Nous vous renverrons un lien permettant de modifier votre mot de passe, et ainsi de vous connecter à votre compte pour modifier l'adresse mail associée."
6,Je voudrais modifier mon mot de passe,"Connectez-vous sur le site avec votre email et votre mot de passe actuel, puis allez dans « Paramètres du compte » en dessous de votre pseudo. 

Un bouton vous sera proposé afin de changer de mot de passe. Vous pouvez également vous rendre directement sur cette page."
7,Je souhaite modifier l’adresse email enregistrée sur mon compte,"Pour changer votre adresse email d'identification, connectez-vous sur le site avec votre mot de passe et l'adresse email sous laquelle vous êtes enregistré, puis allez dans « Paramètres du compte » en dessous de votre pseudo. 

Il suffit alors de cliquer sur le lien « Modifier » à droite de votre adresse. Vous pouvez également vous rendre directement sur cette page.

Une fois la modification effectuée, vous recevrez un email d'activation sur votre nouvelle adresse.
Veillez à toujours utiliser une adresse email fonctionnelle pour votre compte.  Cela vous permettra de recevoir vos confirmations de dépôts/retraits, d'être informé de nos offres ou encore d'obtenir des informations essentielles si vous remportez un package pour un tournoi Live."
8,Je souhaite changer mon pseudo,"Connectez-vous sur le site à l’aide de vos identifiants puis allez dans « Paramètres du compte » en dessous de votre pseudo. 
Un bouton vous sera proposé afin de changer votre nom de joueur.
Vous pouvez également vous rendre directement sur cette page."
9,Je souhaite modifier mon avatar,"Il vous suffit de cliquer le bouton ""Mon compte"" depuis le logiciel, puis sur votre avatar. Vous pouvez également procéder à cette opération via cette page."
10,Je voudrais modifier mes informations personnelles,"Vos informations personnelles (nom, prénom, adresse postale, etc.) sont erronées et vous souhaitez les corriger ?

Connectez-vous sur le site à l’aide de vos identifiants, puis allez dans « Paramètres du compte » en dessous de votre pseudo. Vous pourrez alors procéder aux changements désirés. Vous pouvez également vous rendre directement sur cette page."
11,Comment mettre à jour mes coordonnées bancaires ?,"Vous avez la possibilité d’ajouter de nouvelles coordonnées bancaires sur votre compte en vous rendant dans votre  Espace perso.

Une fois cette opération effectuée, vous pourrez nous faire parvenir une copie de votre nouveau document bancaire (RIB ou justificatif Skrill), en précisant bien qu'il s'agit d'un changement de coordonnées bancaires."
12,Je voudrais créer un autre compte,"Nous vous rappelons que, conformément  à la loi en vigueur, il est interdit de posséder plusieurs comptes sur Winamax."
13,Je voudrais fermer mon compte Winamax,"Vous pouvez procéder à cette opération en vous rendant dans votre Espace perso. Notez qu'en cas de clôture de votre compte, vous perdrez alors tous les avantages liés à celui-ci (miles, tickets et bonus).

Si votre compte a été validé et qu’il présente un solde positif, ce dernier sera viré vers votre compte bancaire dans un délai de 3 jours ouvrables.

Dans le cas contraire, il sera nécessaire de nous transmettre vos justificatifs (pièce d’identité, justificatif de domicile et RIB) pour que nous puissions procéder au virement du solde restant."
14,Je ne veux plus recevoir la Newsletter,Il vous suffit de décocher la case correspondante dans vos préférences emails.
15,Quels sont les méthodes de dépôt disponibles ?,Les moyens de paiement les plus couramment utilisés sont acceptés par Winamax. Vous pouvez consulter la liste complète en vous rendant sur cette page.
16,Je voudrais créditer mon compte,"Connectez-vous au site Winamax avec vos identifiants email et votre mot de passe, puis rendez-vous dans « Mon espace perso » sous votre pseudo.

Cliquez ensuite sur ""Effectuer un dépôt"" en dessous de votre solde. Vous pouvez aussi vous rendre directement ici pour effectuer votre dépôt.

Par ailleurs, en cliquant sur « Mon compte > Dépôt » depuis l'application vous êtes également redirigé vers le choix du mode de paiement."
17,Je n'arrive pas à déposer avec ma carte bancaire,"Vos dépôts ne sont pas acceptés sur notre site ? Avez-vous vérifié : 


Que vous avez saisi le bon numéro de votre carte bleue ? 
Que vous avez saisi le bon code de sécurité (cryptogramme visuel) de la carte (Les 3 derniers chiffres au dos de la carte) ?
Que vous avez saisi la bonne date de validité de la carte ?


Si vous êtes sûr de ces données, vérifiez vos limites autorisées auprès de votre banque et assurez-vous que votre carte ne subit aucun autre problème particulier.

Vous pouvez aussi créditer votre compte en utilisant les autres méthodes de dépôt disponibles.

Enfin, nous vous invitons à vérifier que vos modérateurs de jeux sont fixés de manière à vous permettre d’effectuer un dépôt. Vous pouvez les modifier en cliquant ici. En cas d’augmentation, un délai de 48 heures devra impérativement être observé, conformément à la législation en vigueur."
18,Je voudrais faire un dépôt avec une carte bancaire déjà utilisée sur un autre compte,Vos dépôts ne sont pas acceptés sur notre site ? Avez-vous vérifié :
19,Je dispose d'une nouvelle carte bancaire. Comment faire pour l'utiliser sur mon compte ?,"Si vous êtes sûr de ces données, vérifiez vos limites autorisées auprès de votre banque et assurez-vous que votre carte ne subit aucun autre problème particulier.

Vous pouvez aussi créditer votre compte en utilisant les autres méthodes de dépôt disponibles.

Enfin, nous vous invitons à vérifier que vos modérateurs de jeux sont fixés de manière à vous permettre d’effectuer un dépôt. Vous pouvez les modifier en cliquant ici. En cas d’augmentation, un délai de 48 heures devra impérativement être observé, conformément à la législation en vigueur."
20,Je souhaite faire un dépôt via Paypal,"Une carte de crédit ne peut être utilisée que sur un seul compte. Si vous souhaitez procéder au déblocage de votre carte, merci de contacter le support en indiquant les 6 premiers et les 4 derniers chiffres de la carte concernée (exemple : 123456######1234).

Notez que vous devez disposer d’un compte Winamax validé et être le titulaire de la carte pour que nous puissions procéder à cette opération.

Vous pouvez également créditer votre compte en utilisant les autres méthodes de dépôt disponibles."
21,Mon compte Poker n'est pas crédité,"Aucune manipulation particulière n'est requise. Il vous suffit simplement de renseigner votre nouveau numéro de carte lors de votre dépôt.

Vous pouvez gérer la mémorisation de vos cartes bancaires en cliquant ici."
22,Je souhaite retirer mes gains vers un compte bancaire,"L’adresse email liée à votre compte PayPal doit être la même que l'adresse email renseignée sur votre compte Winamax.
Vous ne pourrez pas effectuer un dépôt via un nouveau compte Paypal si vous avez déjà déposé à l’aide de votre ancien compte Paypal."
23,Je souhaite retirer mes gains vers un compte Skrill,"Lorsqu'un dépôt est validé, un email de confirmation récapitulant celui-ci vous est envoyé. Si vous avez bien reçu cet email mais n'avez pas été crédité sur votre compte, merci de contacter le support client.

Il peut y avoir un léger délai entre le moment où vous effectuez votre dépôt et celui où l'argent apparait sur votre compte Winamax.

Notez que les dépôts par virement bancaire sont traités sous 72 heures ouvrées (hors week-ends et jours fériés)."
24,Je n'ai pas reçu mon retrait,"Vous devez au préalable avoir validé votre compte de manière définitive en nous ayant envoyé dans les délais impartis la copie de votre pièce d'identité et un justificatif de domicile à votre nom. (Pour plus d’informations, consultez la section « Comment compléter mon inscription » au sein de cette FAQ)

Pour retirer votre argent vers un compte bancaire, connectez-vous au site Winamax avec votre email et votre mot de passe, puis rendez-vous dans la section « Mon espace perso ». Cliquez ensuite sur le bouton « Effectuer un retrait » ou rendez-vous directement sur cette page. Vous devrez ensuite renseigner vos coordonnées bancaires, nous transmettre le document bancaire (RIB ou IBAN) correspondant et saisir le montant du retrait désiré.

Il est nécessaire que vous disposiez d'un compte dans une banque établie dans un État membre de l'Union Européenne."
25,Puis-je faire un retrait de mes gains vers mon compte Paypal / Neteller ?,"Pour retirer votre argent vers un compte Skrill, vous devez tout d’abord associer votre compte Skrill à votre compte Winamax en vous rendant sur cette page. 

Vous devrez sélectionner le type de moyen de retrait à ajouter (Skrill) puis saisir l’adresse email liée à votre compte Skrill.

Une fois cette opération effectuée, vous devrez nous transmettre un document attestant que votre compte Skrill a été vérifié."
26,Quelles informations bancaires saisir lors d’une demande de retrait ?,"Lorsque vous demandez un retrait, un premier email de confirmation vous est envoyé pour vous informer que ce retrait est en cours de traitement. 

Vous recevrez un second email une fois votre moyen de retrait validé. Le retrait sera alors automatiquement traité par nos services. 

Les coordonnées bancaires que vous avez renseignées sont rappelées dans cet email. Votre retrait devrait vous parvenir par virement bancaire sur ce compte sous quelques jours (5 jours ouvrables au maximum). 

Notez que les retraits n’apparaissent dans votre historique de compte qu’une fois validés par nos services."
27,Des frais sont-ils prélevés lors des transactions sur mon compte Winamax ?,Il n'est pas possible de procéder à un retrait via un prestataire tel que Paypal ou Neteller. Vos gains ne peuvent être virés que vers le compte bancaire ou le compte Skrill associé à votre compte Winamax
28,Comment bénéficier de mon bonus de premier dépôt ?,"Le bonus de premier dépôt qui est offert correspond à 100% de votre premier dépôt dans la limite de 500 €. Cette offre est automatiquement déclenchée lors de votre premier dépôt si vous y êtes éligible. Nous créditerons votre compte par tranche de 20% de la valeur du bonus dès que vous aurez cumulé assez de Miles. Pour obtenir 1€ de bonus, il vous suffit de cumuler 30 Miles. 

Ainsi, si vous avez déposé 100€ lors de votre premier dépôt, nous vous créditerons 20 € lorsque vous aurez atteint 600 Miles, puis 20€ supplémentaires quand vous aurez atteint 1200 Miles, etc. Au total vous aurez été crédité de 100€ supplémentaires lorsque vous aurez atteint 3000 Miles. 

Vous pourrez suivre l’évolution de vos bonus à partir du logiciel (rubrique ""Mon compte"" puis ""Mes Bonus"") ou depuis cette page.

Pour plus d'informations sur cette offre, nous vous invitons à consulter la rubrique dédiée."
29,Comment bénéficier du montant de mon premier dépôt jusqu’à 100 €   ?,"Lors de votre tout premier dépôt sur Winamax, et avant n'importe quelle action de jeu, nous vous offrons le montant de votre dépôt en Freebets jusqu’à 100 €. Cette offre est déclenchée lors de votre premier dépôt si vous y êtes éligible.

Par exemple, si vous déposez 100 € sur Winamax, vous recevrez immédiatement 100 € de Freebets sur votre compte et pourrez commencer à parier sur les différents sports. Les gains nets issus de Freebets sont versés en cash sur votre compte.


Pour plus d'informations sur cette offre, nous vous invitons à consulter la rubrique dédiée."
30,Comment évolue mon statut VIP ?,"Votre statut VIP (représenté graphiquement par un jeton de métal : Chrome, Aluminium, Bronze, etc.) est mensuel : votre compteur est remis à zéro le 1er de chaque mois et vous devrez à nouveau « cumuler » des Miles pour conserver votre statut et éventuellement l'améliorer.
 
Toutefois, votre statut ne peut qu'évoluer favorablement au cours du mois : dès que vous avez atteint un certain échelon de métal, vous gardez au minimum votre statut jusqu'à la fin du mois suivant, ce qui vous permet de bénéficier des freerolls et des promotions spéciales associées au statut, ainsi que d’engranger vos miles à un coefficient accéléré (x1,25 pour le statut Bronze, x1,5 pour le statut Silver, et ainsi de suite.)
 
Les avantages liés à votre statut VIP, tels que les tickets Freerolls VIP et les bonus à débloquer, sont crédités sur votre compte le mois suivant l’obtention de votre statut.
Les statuts VIP Diamond sont des statuts annuels et tiennent compte des miles accumulés lors des 12 derniers mois.

Pour plus d'informations sur le sujet, n'hésitez pas à consulter le règlement de l'espace VIP."
31,Comment s'inscrire aux tournois gratuits (Freerolls) ?,"Les tournois « Freerolls » sont des tournois gratuits en accès libre pour tous les joueurs de poker de Winamax ayant activé leur compte en argent réel, sans exception.
 
Ces Freerolls, accessibles gratuitement, vous permettent d'éprouver les émotions des vrais tournois et de gagner de vrais euros ! Il y a 12 Freerolls par jour, programmés entre 11h00 et 00h15. Les inscriptions à ces tournois sont ouvertes 30 minutes avant le début de celui-ci, et les places sont limitées. Réservez vite votre siège !"
32,Je veux m'inscrire au Freeroll de mon Statut VIP,"Vous avez obtenu un ticket pour participer au Freeroll de votre statut. Pour vous inscrire, connectez-vous tout d'abord sur notre logiciel.
 
Ensuite, rendez-vous dans la rubrique « Mon compte » pour consulter vos tickets disponibles. En cliquant sur un ticket, vous aurez la possibilité de voir les tournois auxquels celui-ci vous permet de participer et de vous inscrire directement."
33,J’ai reçu un bonus mais il n’a pas été crédité sur mon compte,"Vous devez disposer d’un compte validé pour que vos bonus vous soient crédités. Si vous n'avez pas encore envoyé vos documents, nous vous invitons à consulter la rubrique « Comment activer définitivement mon compte ? » de la FAQ. 

Par ailleurs, vous pouvez suivre l’évolution de vos bonus à partir du logiciel (rubrique ""Mon compte"" puis ""Mes Bonus"") ou depuis cette page."
34,Comment faire la différence entre les tables en argent réel ou Fictif ?,"Vous pouvez basculer entre les deux modes grâce au bouton situé sur le menu principal de l’application (« Home »), à droite de votre pseudo."
35,Comment rejoindre une partie de poker ?,"Tous les formats de poker proposés sur Winamax sont facilement accessibles depuis l’écran principal de notre application : cash-game, Expresso, tournois, Sit&Go, etc. Après avoir cliqué sur la catégorie de votre choix, vous pouvez utiliser les filtres disponibles pour affiner votre recherche et n’afficher que les tables qui vous intéressent. Double-cliquez ensuite sur la table ou le tournoi que vous souhaitez rejoindre, puis cliquez sur le bouton « Jouer », « S’asseoir », ou « Inscription » (selon le type de partie choisi). En tournoi ou en Sit&Go, vous pouvez également vous inscrire directement en cliquant sur le buy-in (prix d’inscription) du tournoi affiché dans la colonne de droite.

Si la table choisie est pleine, vous aurez la possibilité de vous inscrire en liste d’attente. Dès qu’un siège sera libre, vous serez automatiquement installé à cette table.

Si vous débutez, nous vous recommandons une table en Argent Fictif, c’est-à-dire une table où vous ne jouez pas de véritable argent."
36,Qu’est-ce que le Playground ?,"Le Playground est une toute nouvelle interface développée par Winamax, conçue pour faciliter l’organisation des tables de poker sur votre (ou vos) écrans. Les amateurs de multitabling (plusieurs tables jouées simultanément) apprécieront particulièrement cette fonctionnalité exclusive à Winamax, et dont nous dévoilons tous les détails sur cette page."
37,Qu’est-ce que le HUD (Heads-Up Display) ?,"Le logiciel Winamax intègre un tableau de bord de statistiques, actualisées en temps réel et affichées directement sur la table de poker. Ce tableau de bord (en anglais HUD, pour Heads Up Display) vous permet d’affiner votre connaissance de vos adversaires (et de vous-même au passage !), en gardant en mémoire certaines données clés de l’action à table. Toutes les explications sur le fonctionnement du HUD sont détaillées sur cette page."
38,Comment recharger mon compte Argent Fictif ?,"Vous pouvez recharger votre compte en Argent Fictif via l'application. Connectez-vous et cliquez sur ""Mon compte > Argent fictif "" puis ""Recharger"". Notez que les recharges de votre compte Argent fictif sont limitées à 2 recharges gratuites toutes les 24 heures."
39,Mon solde poker n'est pas à jour,"Lorsque vous quittez une table de cash-game, votre argent, qui est momentanément bloqué sur la table, est reversé sur votre compte quelques instants plus tard.

Votre solde est affiché dans le coin supérieur droit du logiciel, ainsi que sur le menu principal (« Home ») et dans votre espace personnel sur le site Web."
40,Comment utiliser un ticket de tournoi ?,"Lorsque vous gagnez un ticket, vous bénéficiez d’une entrée gratuite pour un tournoi du montant du buy-in indiqué sur le ticket.

Les tournois pour lesquels ce ticket est utilisable seront repérables grâce à l’icône « Ticket » apparaissant dans une case jaune dans le menu des tournois. Notez que les tickets ont une date de validité. Vous pouvez consulter cette date de validité en vous connectant sur votre espace personnel ou depuis le logiciel en cliquant sur le bouton « Mes tickets » depuis le menu d’accueil (« Home »). De plus, en cliquant sur un ticket, vous aurez la possibilité de voir les tournois auxquels celui-ci vous permet de participer."
41,Je ne trouve pas un tournoi en particulier,"Si vous ne parvenez pas à trouver un tournoi donné, nous vous invitons à vérifier que vos filtres de recherches (menus déroulants au-dessus de la liste des tournois) n’en bloquent pas l’accès.

Vous pouvez également utiliser la fonction « Recherche » (icône représentant une loupe en haut à gauche de la fenêtre du logiciel) pour saisir directement le nom du tournoi concerné."
42,Comment montrer mes cartes aux autres joueurs ?,"Pour montrer ses cartes aux autres joueurs de la table au moment où vous remportez un coup, il vous faut désactiver l’option « Cacher les mains gagnantes » directement depuis la table de jeu (cliquez sur le bouton « … » en bas à droite). Cette opération peut aussi être réalisée dans les options du logiciel. Pour ce faire, cliquez sur le « Menu Burger » (les 3 barres parallèles dans le coin supérieur gauche de la fenêtre), puis sur « Options » puis sur « Jouabilité ». 

Si vous avez activé l’option « Montrer certaines cartes », vous pourrez cliquer sur une ou plusieurs de vos cartes privatives pour ne montrer que celle(s)-ci à la fin de la main."
43,Je souhaite récupérer mon historique de mains et mes notes sur un autre ordinateur,"Les notes sont synchronisées à chaque lancement de l’application, vous retrouverez donc celles-ci même si vous ne vous connectez pas sur votre ordinateur habituel. En revanche, les fichiers d’historique de mains sont enregistrés localement sur votre disque dur dans le répertoire suivant : C:\Users\[Votre nom d’utilisateur]\AppData\Roaming\winamax\documents (sur PC) ou /Users/[Votre nom d’utilisateur]/Library/Application Support/Winamax/documents (sur Mac). Pour accéder directement à ces dossiers, rendez-vous dans les options du logiciel puis dans « Général ». Si vous n’avez pas accès au répertoire, vous pouvez effectuer une demande d’historique de mains en vous rendant sur cette page."
44,Est-il possible de jouer plusieurs tables en même temps ?,Vous pouvez tout à fait jouer sur plusieurs tables en même temps si vous le désirez. Le nombre maximum de tables pouvant être ouvert simultanément est déterminé par la puissance de votre équipement informatique.
45,Comment utiliser les options de l'application ?,Vous trouverez une description des fonctionnalités de notre logiciel sur cette page.
46,Comment signaler des propos vulgaires et/ou interdits sur les tables ?,"Nous prenons très au sérieux tout manquement à notre charte de bonne conduite. Nos modérateurs s’assurent que celle-ci est bien respectée et appliquent les sanctions nécessaires en cas de débordement.

Cependant, en raison du grand nombre de tables et de discussions à surveiller, certains propos déplacés peuvent échapper à notre vigilance. Par conséquent, si vous observez de tels agissements, nous vous invitons à les signaler en nous communiquant le pseudo du ou des joueurs concernés et en nous faisant parvenir des copies d'écran illustrant ces propos."
47,Je ne parviens pas à me connecter,"Vérifiez tout d'abord l'état de votre connexion Internet, et veillez à ce que votre antivirus, pare-feu (firewall) et/ou votre équipement réseau ne bloque pas l'application.
Si vous avez perdu votre mot de passe, vous pouvez le modifier sur cette page. 

Si malgré tout vous ne parvenez pas à vous connecter, n'hésitez pas à envoyer un email au support en expliquant votre problème."
48,Comment configurer mon Pare-feu/firewall pour jouer ?,"Pour pouvoir jouer sur notre application en étant derrière un firewall, il faut que ce dernier soit configuré de manière à autoriser les connexions via le port 443."
49,Winamax est-il compatible avec Windows® ?,Le logiciel fonctionne parfaitement sous Windows®. N'oubliez pas d'ajouter Winamax dans les programmes de confiance de Windows.
